{
  "spec_version": "1.0",
  "family": "headphone_topper",
  "template": "headphone_topper@1",
  "params": { "width_mm": 70, "depth_mm": 40, "height_mm": 38, "room_mm": 30 },
  "features": [
    { "type": "emboss_text", "text": "Asha", "anchor": "face", "depth_mm": 1.2, "mode": "emboss" }
  ],
  "style": "none",
  "material": "terracotta_silk"
}
